{
  "id": "dae-han",
  "name": "Dae Han",
  "category": "hero",
  "format": "interval",
  "format_meta": {
    "rounds": 3,
    "scoring": "time"
  },
  "movements": [
    {
      "exercise": "run",
      "distance_m": 800,
      "notes": "carrying an empty barbell"
    },
    {
      "exercise": "rope-climb",
      "reps": 3,
      "notes": "to 15 feet"
    },
    {
      "exercise": "thruster",
      "reps": 12,
      "load": {
        "rx_male": "135lb",
        "rx_female": "95lb"
      }
    }
  ],
  "partition": null,
  "scaling": null,
  "origin": null,
  "tags": [
    "running",
    "barbell",
    "gymnastics",
    "3-rounds"
  ],
  "source_notes": "crossfit.com/benchmark/dae-han (official CrossFit Hero WOD page), retrieved 2026-07-09",
  "schema_version": "1.0",
  "last_updated": "2026-07-09"
}
