{
  "id": "marston",
  "name": "Marston",
  "category": "hero",
  "format": "amrap",
  "format_meta": {
    "time_cap_minutes": 20
  },
  "movements": [
    {
      "exercise": "deadlift",
      "reps": 1,
      "load": {
        "rx_male": "405lb",
        "rx_female": "275lb"
      }
    },
    {
      "exercise": "toes-to-bar",
      "reps": 10
    },
    {
      "exercise": "bar-facing-burpee",
      "reps": 15
    }
  ],
  "partition": null,
  "scaling": null,
  "origin": null,
  "tags": [
    "amrap",
    "barbell",
    "gymnastics"
  ],
  "source_notes": "crossfit.com/benchmark/marston (official CrossFit Hero WOD page), retrieved 2026-07-09",
  "schema_version": "1.0",
  "last_updated": "2026-07-09"
}
